{
  "kind": "review",
  "schemaVersion": "1.2.0",
  "assetId": "enemy-mob-32-cannonjaw-puffer",
  "approvedRevisionId": null,
  "candidate": {
    "revisionId": "r001",
    "lane": "archive"
  },
  "notes": [
    {
      "id": "note-c41f49f9-b3ee-452d-934c-46ee971bb917",
      "text": "The sprite does not resemble a recognizable creature or object; rebuild the defining silhouette and focal feature.",
      "createdAt": "2026-08-01T10:39:43.932Z",
      "resolvedAt": null,
      "target": {}
    }
  ],
  "archiveHistory": [
    {
      "revisionId": "r001",
      "archivedAt": "2026-08-02T12:35:32.135Z",
      "restoredAt": null
    }
  ],
  "updatedAt": "2026-08-02T12:35:32.135Z"
}
