{
  "kind": "review",
  "schemaVersion": "1.2.0",
  "assetId": "enemy-mob-32-gullspear-skirmisher",
  "approvedRevisionId": null,
  "candidate": {
    "revisionId": "r001",
    "lane": "archive"
  },
  "notes": [
    {
      "id": "note-e69ef4d8-a1ff-44a4-b855-e118df9947da",
      "text": "need to fix the foot/leg",
      "createdAt": "2026-08-01T10:40:17.256Z",
      "resolvedAt": null,
      "target": {}
    }
  ],
  "archiveHistory": [
    {
      "revisionId": "r001",
      "archivedAt": "2026-08-02T12:35:32.809Z",
      "restoredAt": null
    }
  ],
  "updatedAt": "2026-08-02T12:35:32.809Z"
}
