{
  "kind": "review",
  "schemaVersion": "1.2.0",
  "assetId": "enemy-mob-32-steppe-centaur-raider",
  "approvedRevisionId": null,
  "candidate": {
    "revisionId": "r001",
    "lane": "revise"
  },
  "notes": [
    {
      "id": "note-7729bd7d-c4b5-43f3-8840-85a02e326f8b",
      "text": "The sprite is not readable at 1x; strengthen the silhouette, focal feature, and major value groups.",
      "createdAt": "2026-08-02T02:02:52.214Z",
      "resolvedAt": null,
      "target": {}
    }
  ],
  "archiveHistory": [],
  "updatedAt": "2026-08-02T02:02:52.214Z"
}
