{
  "kind": "review",
  "schemaVersion": "1.2.0",
  "assetId": "enemy-mob-32-roadknife-cutpurse",
  "approvedRevisionId": "r001",
  "candidate": {
    "revisionId": "r002",
    "lane": "intake"
  },
  "notes": [
    {
      "id": "note-35c7a3ca-8d66-4660-bdb5-6f0ca8235894",
      "text": "Below current motion floors in the weakest direction: idle changes 0px beyond translation (floor 6) and walk 7px (floor 15 on two frames). Rebuild idle and walk with anatomy motion - planted feet, moving limbs or masses - per checklist section 4. Also keep ground contact planted (no whole-body bob).",
      "createdAt": "2026-08-02T12:06:55.404Z",
      "resolvedAt": "2026-08-02T16:31:40.000Z",
      "target": {}
    }
  ],
  "archiveHistory": [],
  "updatedAt": "2026-08-02T16:31:40.000Z"
}
