{
  "kind": "review",
  "schemaVersion": "1.2.0",
  "assetId": "enemy-mob-32-brimstone-hound",
  "approvedRevisionId": null,
  "candidate": {
    "revisionId": "r001",
    "lane": "archive"
  },
  "notes": [
    {
      "id": "note-6bc76a56-3858-4841-877d-ea2d283661ac",
      "text": "The sprite is not readable at 1x; strengthen the silhouette, focal feature, and major value groups.",
      "createdAt": "2026-08-02T02:20:46.274Z",
      "resolvedAt": null,
      "target": {}
    }
  ],
  "archiveHistory": [
    {
      "revisionId": "r001",
      "archivedAt": "2026-08-02T12:35:32.017Z",
      "restoredAt": null
    }
  ],
  "updatedAt": "2026-08-02T12:35:32.017Z"
}
