{
  "kind": "review",
  "schemaVersion": "1.2.0",
  "assetId": "enemy-mob-32-bottlewick-lobber",
  "approvedRevisionId": null,
  "candidate": {
    "revisionId": "r001",
    "lane": "revise"
  },
  "notes": [
    {
      "id": "note-41b5eb04-cc71-43f6-b1be-2b4c072f5157",
      "text": "The sprite is not readable at 1x; strengthen the silhouette, focal feature, and major value groups.",
      "createdAt": "2026-08-02T11:55:41.786Z",
      "resolvedAt": null,
      "target": {}
    }
  ],
  "archiveHistory": [],
  "updatedAt": "2026-08-02T11:55:41.786Z"
}
