{
  "kind": "review",
  "schemaVersion": "1.2.0",
  "assetId": "enemy-mob-32-mosscrypt-knight",
  "approvedRevisionId": null,
  "candidate": {
    "revisionId": "r001",
    "lane": "revise"
  },
  "notes": [
    {
      "id": "note-2d190fce-e978-4801-863f-56265a5f4a6a",
      "text": "The sprite is not readable at 1x; strengthen the silhouette, focal feature, and major value groups.",
      "createdAt": "2026-08-01T10:37:58.053Z",
      "resolvedAt": null,
      "target": {}
    }
  ],
  "archiveHistory": [],
  "updatedAt": "2026-08-01T10:37:58.053Z"
}
