{
  "kind": "review",
  "schemaVersion": "1.2.0",
  "assetId": "enemy-mob-32-tidepool-slime",
  "approvedRevisionId": null,
  "candidate": {
    "revisionId": "r001",
    "lane": "archive"
  },
  "notes": [
    {
      "id": "note-c5013b94-68f4-4da4-a89b-691a57d4f1a9",
      "text": "The outline is too heavy, broken, or noisy; simplify it and use dark pixels only where they clarify the silhouette or separate forms.",
      "createdAt": "2026-08-01T10:40:29.457Z",
      "resolvedAt": null,
      "target": {}
    }
  ],
  "archiveHistory": [
    {
      "revisionId": "r001",
      "archivedAt": "2026-08-02T12:35:34.216Z",
      "restoredAt": null
    }
  ],
  "updatedAt": "2026-08-02T12:35:34.216Z"
}
