{
  "kind": "review",
  "schemaVersion": "1.2.0",
  "assetId": "enemy-mob-32-obelisk-crawler",
  "approvedRevisionId": null,
  "candidate": {
    "revisionId": "r001",
    "lane": "revise"
  },
  "notes": [
    {
      "id": "note-eb14d68d-a6c8-4148-a59b-f02934eecee7",
      "text": "The sprite does not resemble a recognizable creature or object; rebuild the defining silhouette and focal feature.",
      "createdAt": "2026-08-01T10:39:00.309Z",
      "resolvedAt": null,
      "target": {}
    }
  ],
  "archiveHistory": [],
  "updatedAt": "2026-08-01T10:39:00.309Z"
}
