{
  "kind": "review",
  "schemaVersion": "1.2.0",
  "assetId": "enemy-mob-32-cairn-troll",
  "approvedRevisionId": null,
  "candidate": {
    "revisionId": "r001",
    "lane": "archive"
  },
  "notes": [
    {
      "id": "note-027bcd63-fc6b-4e6e-bfb7-92e9dfb69d5b",
      "text": "The sprite is not readable at 1x; strengthen the silhouette, focal feature, and major value groups.",
      "createdAt": "2026-08-02T01:26:03.812Z",
      "resolvedAt": null,
      "target": {}
    }
  ],
  "archiveHistory": [
    {
      "revisionId": "r001",
      "archivedAt": "2026-08-02T12:35:32.111Z",
      "restoredAt": null
    }
  ],
  "updatedAt": "2026-08-02T12:35:32.111Z"
}
