{
  "kind": "review",
  "schemaVersion": "1.2.0",
  "assetId": "enemy-mob-32-pebbleback-crayfish",
  "approvedRevisionId": null,
  "candidate": {
    "revisionId": "r001",
    "lane": "archive"
  },
  "notes": [
    {
      "id": "note-7867da32-985f-4ad9-83c1-1f04d294962f",
      "text": "The front and back views do not look like the same creature as the side views; unify the proportions, body plan, and identifying features.",
      "createdAt": "2026-08-02T00:52:44.259Z",
      "resolvedAt": null,
      "target": {}
    }
  ],
  "archiveHistory": [
    {
      "revisionId": "r001",
      "archivedAt": "2026-08-02T12:35:33.597Z",
      "restoredAt": null
    }
  ],
  "updatedAt": "2026-08-02T12:35:33.597Z"
}
