{
  "kind": "review",
  "schemaVersion": "1.2.0",
  "assetId": "enemy-mob-32-mossback-tuskling",
  "approvedRevisionId": null,
  "candidate": {
    "revisionId": "r001",
    "lane": "archive"
  },
  "notes": [
    {
      "id": "note-ad8364f3-9d2d-4013-9632-45e627d97e5d",
      "text": "needs some more detailø in face",
      "createdAt": "2026-07-31T23:51:37.552Z",
      "resolvedAt": null,
      "target": {}
    }
  ],
  "archiveHistory": [
    {
      "revisionId": "r001",
      "archivedAt": "2026-08-02T12:35:33.325Z",
      "restoredAt": null
    }
  ],
  "updatedAt": "2026-08-02T12:35:33.325Z"
}
